temp_id,text,dysphoria
8497,"ill start this by saying im afab and have been identifying as a trans guy and using he/him pronouns since early december 2019. since i was a really young kid, i always felt like a boy and tried to play the boy role in everything, yk? and i was relatively comfortable identifying as a guy, and before i came out the idea of being perceived as a guy always made me feel good.
but lately, i have this continuous conflict in my mind that i just cant make go away. whenever im called she/her, i dont really care? it doesnt really effect me, but it still doesnt feel entirely comfortable. ive come to discover that the same goes with being called he/him, i dont feel entirely comfortable with those pronouns either.... and the same with they/them. i feel most comfortable presenting masc, and i try to hide my chest as much as possible. if i get gendered as a girl, i dont feel much dysphoria? i think the sudden pang of emotion i feel from being gendered as a girl is more one of surprise that someone could look at how masc i am and read me as a girl, if that makes sense.
i always hated having a chest, but my chest is on the larger side, and thats always been uncomfortable for me, which i guess might be a reason as to why id try to hide it. the thing is, i only really get uncomfortable if other people see how large my chest is and wish i had a completely flat chest, but i dont really get bothered when im by myself.
i tried to make as much sense as i could, so feel free to ask me questions to get a better understanding of how im feeling, if you want. am i just better off without a label, or whats going on? any help at all is appreciated, thank you for taking the time to read this",1
610,i've seen on my social media apps and have talked to people irl that have wondered if its to late to come out because they've seen and heard some say they community treated them badly.  the answer is no its never to late.  people realize their sexuality at different ages and for different reasons and they come out at different ages for different reasons.   a lot of people like me figure it out at a young age others much later in life and others somewhere in between.  it doesn't matter when you realize it its always ok to come out if you're ready.  now i always add for young people if its safe to do so.  i won't go into my whole coming out story again( dm me if you want whole story i'll share it there) but i was kicked out but back then it never crossed my mind that could happen.  we should never judge someone for when they come out.  we don't know their situation.  it could be as a young person their family was so homophobic they just suppressed those feelings and now they've resurfaced.  it maybe they live in a country where they're punished by jail or death and had to get to a country that's safe.  and it could be they just never realized their feelings until now.  whatever the reason coming out is a personal journey for everyone to take when they're ready.  rushing it can lead to consequences your not ready for so please don't shame people for coming out late instead embrace the fact that they finally were ready to do so.  we should be a community of love and acceptance not bullying.  god knows we've all had enough of that not too do it to anyone else.,0
18302,im straight and really like this dude and for some reason im getting this vibes that he swings both ways. i really dont care if he is. im very accepting but he got mad and then blocked me. his reaction was telling me he is bi.. and disappointed me coz blocking was so immature.,0
8358,"so quarantine has got me thinking about my sexuality and now i think that i (20f) am bi. i dont really have people to talk to about this so here we are.  i grew up in a conservative, strict and religious home. i quickly was drawn to sports as a kid and was a hardcore tomboy for as long as i can remember. high school hit and i realized that i wasnt like other girls. i hated not fitting in so i always portrayed myself as being an athletic but straight female. now being in college i have finally learned that there is more to life than my conservative religious town i grew up in but have always been scared to experiment because of the opinions of my family and friends.  flash forward to this quarantine i get time to reflect on myself. i realized that i have always had a weird hunch about girls. i would get these feelings that i would suppress to i really want to be friends with her even though now i think there was way more to that. i now realize that girls always catch my eye first whether it be their hair or outfit i just love to look at them. i also fan girl hard with the us womens national soccer team, like i absolutely adore alex morgan and ship preath so hard (but that just might be because i love sports). i also love seeing lesbian couples on shows and it gives me a sort of hope almost?? idk.  now dont get me wrong i do enjoy hanging out with guys (as i relate to them more) and i have been in relationships with guys before but i feel like ive always been missing something and it feels very forced. i do fantasize about both genders and the experiences i have had (rarely with girls) so i do think i am somewhat bi but right now there is nothing i can do to help solidify how i feel and i feel very lost.  i just really want quarantine to end so i can actually try something new with girls and see how that goes (but i also am scared to do that. any advice?) but for now am i really bi or am i just bored with the guys ive been with? does anyone have any advice on what to do in general as to help me solidify this decision or does this label even matter that much?",0
7948,"so basically i am moving to an entirely new city to start university and i am really scared that i will scare away people by being myself because i do not know what i am. like even thought lgbtq+ is widely accepted you are usually expected to be able to say ""i'm gay"" etc. i can't even say my gender because i am still figuring it out.  i am afraid i am less easy to talk to in comparison to someone who has it all together?",0
25972,"hey everyone, new here. i've been questioning my gender more and more lately and want to be a little more expressive in my clothing. i've never really shopped outside my assigned gender (amab) except for a jumpsuit and a button down (both from target). does anyone else who may have a more ""masculine"" body type have any suggestions for places or have any guides for shopping for more gender-neutral or feminine clothing that would fit? just heading into the women's section at a store is a little intimidating without really knowing where to start. thanks in advance and apologies if i'm using any terms wrong (again, new here).",0
19551,i am a bisexual female but i look very straight. i want to meet a girl though and im not sure how. im not comfortable with online dating. i prefer to meet people naturally but i dont know how to tell if a girl likes girls.,0
3579,"im a cis bisexual guy. i am not trans, i am not a woman. im 99.9% confident in that.
but that 0.1% has been nagging in the back of my brain for weeks now. i really dont know how to explain my feelings about my gender. i just genuinely think i wouldve been better if i was born a girl-more attractive, more likable. something about the female experience is just so desirable to
me. if someone gave me a button that allowed me to immediately turn into a cisgender woman i would press it with very little hesitation. but the idea of actually transitioning mortifies me and makes me really unsure about my true feelings. does anyone have any advice for me, a teenageperson trying to understand their gender?",0
3867,"so for awhile now i've been feeling asexual, because i pretty much never see someone and want to have sex with them. but recently i was thinking about romance, and though i've never wanted a romantic relationship and always denied those who tried to pursue me, when i was thinking about if i were in a romantic relationship, i kinda liked it? and to make things more confusing for myself i felt sort of the same way about being in a romantic relationship with men and women.  even more confusingly, the idea of having sex with this hypothetical significant other wasn't that bad either. but at the same time, i'd never pursue a sexual relationship and i really don't think i'd pursue a romantic one either. i have a lot of conflicting feelings.",0
25261,"i've been feeling 'not entirely feminine' for a lot of my life, but i just figured it was because being feminine was seen as weaker and i didn't like that. as it turns out, i was just being really dumb, but i've started accepting the way i actually am, and recently i changed my name. i love my new name, and i love being called my name, but i feel kind of upset at losing my old name? it feels like leaving behind a big part of who i am and it's really scary, did anyone else feel like this? i always thought that my name was the thing that separated me from the rest of the universe, and without it i'd just spill out, and changing it is good but freaking me out a little. any advice on how to cope with it, it's kind of a bad feeling :/",0
374,"before i begin, i should note that i am a gay trans-man who's been out for 12 years and has been active in my lgbt+ group for that long.  plus i'm already on testosterone. i knew since i was five that i was a boy, and had to deal with haters my whole life.  this woman in my group is an ugly fat girl with no friends decided to come out as nonbinary. she said she only discovered her identity within the last month. i called bullshit on her, and got a few others to join in with me. she never returned to the meetings, which is good because the lgbt+ doesn't need attention seekers like her. this woman infuriates me because she undermines people who actually feel uncomfortable in their own skin, and i feel proud that i put a stupid cisgender person in their place.  what would you have done?",0
126,"this is something that i fear will legitimately turn into a depressing issue for me.  im 34 years old.  born &amp; raised in south louisiana.  i am the least boastful person - if anything, i have terrible self confidence, but i am fully aware that im considered an attractive guy.  the issue i leaned towards earlier is that i love companionship and would love a partner or hell even a fwbshit i would love to just have friends!  people assume that i have guys knocking my doors down, have to have a significant other in my life, have no problem in the relationship or love dept, etcwhen its the exact opposite.  so, considering id honestly love to have someone, friends or just meaningful relationships and everyone assumes i have a plethora of those, its legitimately depressing how alone i actually am and feel.  does this make sense?   any advice?",0
3565,"slightly nsfw warning  hey everyone. i'm 19f and i recently came to terms with the fact that i am quite pansexual. however recently i have been wondering whether i fit that label in particular since my attraction to someone mostly lies in the sensual attraction, aesthetic attraction and if they are a nice person in general. i never look at someone and go, oh i would like to have sex with them and in the moments i have ventured to porn, i noticed that i am attracted to the action than the people in general. like a person alone will never turn me on but actions and what they do might.  truthfully i would be down to have sex with them cuz sex is...well sex. it's just a way to get off i suppose. but i would never be attracted to then and to be honest i prefer the sensual acts to sex.   so my question is, could i be on the ace spectrum? i would really appreciate your help",0
9730,"i feel like i'm not ""trans enough"" to call myself a guy. how will others react if i told them my feelings? what if i regret transitioning? should i even bother?
i wouldn't get a nice penis even if i wanted to, and my life is pretty gender neutral.
i just wanted to say it.",1
26388,amab enby fem here.  my daughter purchased a set of boom sticks (google it and youll see them) for a subtle makeup look for both of us.  has anyone used these before ? if you have what was your experience?   im just trying to start up with the makeup skills and i dont wanna go full force in start subtle and move upward from there.   thoughts? comments ?,0
19766,"hi all 33(m) bi guy here in a long term 8 year ""hetero"" relationship i guess is how it would be described,  me man she woman lol  she knows and we're fine with it, she is the person i want to grow old with , close friends know, my mum knows , my dad in clear denial just easier to let him think i'm a good little straight boy lol. the thing is i want to start living my best life but i'm shy af not great at initiating conversations.  when it comes to my job i believe my sexual orientation shouldn't matter as it doesn't impact how i do my job but at the same time i don't feel like i should hide it, my documentation says i'm bi, an old manager knew and basically said "" well don't come onto me"" he left a year later fortunately but i want ways to say i'm bi without just outright saying it. ""hey i've got those reports , as you can see sales have dropped, i enjoy penis and vagina , and purchase orders really went through the roof on tuesday "" lol so what i'm looking for is something i could put on my desk that's subtle (so no pride coloured dildos) so if people  see it if they know the colours , they may go ""you know that's a bisexual (insert object here)""  and i can just reply ""yeah i'm bi"" not trying to flaunt it , just sexual orientation doesn't really come into conversation at work and it doesn't affect how i do my job , just people may be more mindful of slurs and something small could help start the conversation.",0
2624,"i am a 24 year old woman and i came out officially 4 years ago to my family. my grandmother on my fathers side is gone, and my grandmother on my mothers side is no longer speaking to me. most of my family has been fairly supportive but when i talk about missing my grandmother they tell me i shouldnt have told her in the first place. my grandpa says he still loves me but no one answers when i call their house.  ive always been closer to older women in my life and ive never had a time until now that ive not had an older woman to befriend and look up to, to have that connection with like i have in the past. i miss that terribly. i dont know if i should have or shouldnt have told her but i do feel this little voice in the back of my head sometimes that gives me a lot of grief. you should have just waited til she died. and such. i love her still, despite this. and i miss her. i wish she could be ok with me again.",0
5253,"im fine with any pronouns but id prefer not to be called, a girl, a boy, etc.,
im assuming im agender?? but im also not really sure what agender is.
does anyone know what id be? im sorry if i phrased this bad, thank you in advance!!!!",0
20724,"does anyone else feel like they have been able to hold somewhat of a ""normal/heterosexual"" lifestyle without struggle and feel a sort of guilt in comparison to people who lean more ""gay"" on the spectrum?",0
19964,so in the past year i have been trying to fix myself (mentally). but it only lead to me questioning myself even more. i struggle with social anxiety and depression. so is there even a way to find out if i'm actually bi because i have been leaning more bi than straight the more i think about it.,0
5583,"so i've started questioning and i'm still not totally sure what is my gender. i'm currently using both the agender and genderfluid labels, so i think im somewhere in between. i'm afab and have been ok with she/her for most of my life, but they always felt a bit off. my pronouns were she/they, but i've changed to she/he/they because i don't feel comfortable with she/her most of the time. i would rather be perceived as androgynous, or really anything that's not a girl, however i do like wearing makeup/dresses and skirts occasionally. i also feel uncomfortable with my ""female"" body parts, but i don't experience dysphoria.  i've started referring to myself as a guy, however i don't think i'm ftm either, because its always changing. but i don't feel like any gender at the same time. i've thought about labelling myself as genderfluid but i don't think that fits either. if anyone has any suggestions please tell me :]",0
11980,"i've been married for 4 years now and love my wife. she means the world to me. when i was younger i used to think i was transsexual. i would fantasize about being a woman (but keeping my penis). that then evolved into being attracted to women and men, while frequently crossdressing. now, although i have sex with my wife and i do enjoy it, what really turns me on is either a) male genitalia or b) being treated as a woman in bed.  for example, over the past couple years my wife has fucked me with a strap on, which is my favorite type of sex. she also has focused on my nipples (touching, licking, etc) and now i feel like they're more sensitive than my penis. if i spend the time, i can cum just from playing with my nipples. all this has slowly brought up the repressed feelings i had before i met my wife. i am constantly wanting to dress up as a woman. i want big beautiful breasts. i want to be the woman i know i can be. but this comes and goes. it's really conflicting. at times i just want to be a woman. at other times, i don't because of how much i love my wife. i know she is bisexual and is attracted to women (which explains her addiction to my nipples), but i don't know how she would react if i said i wanted to grow my own breasts. my entire life i have not just gone out and dated a guy or tried to crossdress full time because of my family and now my wife. i feel like i'm missing a part of me and i don't really know what to do. the last thing i'd want to do is compromise what i have with my wife, but after years of looking at myself in the mirror and not seeing the breasts and feminine form i know i am is frustrating. i still want to keep my penis so i would still be able to satisfy her sexually, but i just don't know what to think.",0
20919,"what if i get more aroused by womens bodys? i do get aroused by men and features of men like their faces, shoulders, jaw line, neck, butt, attitude, stomach, thighs, and dick. like thats what is normally going on in my fantasies like a hard dick or looking at their face or their shoulders or jaw while they are fucking me or something but women and their bodies arouse me quit a bit more. i could just think of boobs and bam. i guess it would be like saying yea i love strawberries and bananas but i like bananas more? but i still love strawberries.",0
20652,why is my dick so soft when with ladies and not when i am by myself alone,0
25879,"hi genderqueer community. i posted a similar thing to this on the reddit sexuality but, i just found this reddit and felt like it fit more in here. recently i've been questioning myself and who i identify as a lot. i was born female (she/her) but have a problem with appearing ""feminine"" - well not just that, resembling a woman makes me feel so uncomfortable. i hate my breasts, butt, face, voice etc. and feel comfortable looking like a ""male"". 
i've cut my hair off, wear a binder and have been trying to lose weight recently and i have been feeling so much better about myself ever since!- i am just confused about a few things.. the main thing being, i don't mind people calling me by my birth name ""lillith"" and calling me by she/her pronouns... i hate looking like a female but i don't really have a problem with people calling me by those pronouns and my name. does anyone feel the same way as me?",1
12922,pm me for my discord or whatever,0
4587,"hi! i'm questioning my gender, and there's something that makes me unsure about the possibility of being non binary. i'm amab and, even if i feel like i may be bigender (i feel like it may be both man and woman, in my case), i feel impostor syndrome related to the way i experience sexual desire.  first of all, as a premise, i feel sexual attraction to women. what confuses me is that my sexual attraction can be described as something similar to what cis men usually seem to experience. i can find specific body parts arousing (legs, certain shapes), and i also have a foot fetish. i know that it seems to be a fetish far more common in men rather than women, so it makes me feel like a fraud.  i basically feel like my sexual attraction is more tied to the one of a cis man, rather than the one of a woman. an attraction based also on visual stimuli, even if i take into account the romantic part too. so, my question is: am i overthinking this or the way i relate to cis men's sexuality and fetishes is actually a sign that i'm just cis?",0
8460,"hey, i'm a 19 years old amab, and i've been seriously questioning my gender identity for a while now.
to start with, i've dealt and still deal with a lot of internalized transphobia, and there was a period in my life, when i was around 16-17 years old, where i was obsessively afraid of being transgender, with persistent, intrusive thoughts about the matter. kind of like ocd, in a way.
but now that i'm older and said toughts don't come with an immense fear attached to them, i've started to really think about my gender. i met a non binary person through a d&amp;d group of all places, and meeting them opened my eyes to a possibility i didn't really think about when i was a bit younger.
in the last few months i realized how little i liked being a man. i didn't feel comfortable with people thinking and recognizing me as one, and i couldn't connect with the concept of being it. i've always had a fear of growing up and becoming a grown adult male, but it has become more persistent and vivid in the last months. i can't imagine myself feeling comfortable in the skin of a man. 
now the tricky part is here, i'm well aware of toxic masculinity and the lack of a good male identity in progressive-leaning men, i never really had good male role models to look up to, and honestly, i'm not sure if my discomfort with being seen ad male comes, at least partially, for the misogynistic gender roles generally associated with men
would i be more comfortable with they/they pronouns? yeah, probably, i would also feel better with a more androgynous appearance. thinking about it, i'd like to be seen from outside of the binarity of gender, it's something i've wanted for a while, but a part of me is afraid i'm actually escaping from something, running away from ""being a man"" and what that entails",1
1987,i was watching stand by me and all i could think about was chris and gordie being gay and honestly im disappointed in myself,0
16893,"hi everyone! been a part of this sub for a while now but have never posted anything, so this is a bit intimidating! i'm currently staying in athens, greece for a couple of months by myself. i'd never been here before and i don't know anyone here, but i'm having a blast! the only thing is, im struggling with how to make friends that are gay girls. i've been doing lots of research, and i've had a hard time finding lesbian-specific areas around here, seems like a lot of the lgbt scene is centered around gay men. i'm not really the type to go on tinder or other apps to try to meet people, so here i am to ask: how can you make gay friends when you're traveling alone?!! anyone in athens want to make a new friend and give me the lesbian tour? any tips or suggestions are welcome, and my dms are open! this subreddit is always a source of love and light to me, so thank you for that no matter what happens. much love to my fellow wlws !",0
15979,"i'm 25 and i swear i feel like i don't know any way of making lady friends let alone looking for a girlfriend. it was hard before the pandemic, but now everything is online. i'm a gamer and a nerd so a lot of online places i go are all guys. does anyone have advice on where to go or what to do to meet people?",0
11067,"i don't know where to start so i'm just going to jump in.  i'm 25 and a female. a lesbian. i am not attracted to guys whatsoever. but, i have been questioning if i'm transgender or not.  i love being a lesbian like the lifestyle and 'being different/unique'. i have real short hair, dress like a guy, have a deeper voice (than most females i guess), and get mistaken for a guy all the time. when i was 16, i found out about 'transgenders' and i have been questioning myself since. i've always felt more comfortable in guy clothes and looking like a guy. when i look in the mirror naked, i don't feel right. i look like a guy with big boobs. i love my body parts and don't want to have surgery because if i wanted to be a guy, i would want working parts.  surgery is what confuses me the most. i know your 'penis' wouldn't work like an actual penis and i don't want that. i would want the real thing. but i love my vagina and i somewhat love my boobs. i've thought about doing top surgery but then again, i would feel weird with no boobs and having a vagina. and i wouldn't know what to classify myself as.  i get so emotional talking about it because i don't know what to define myself as. i don't know what to do. i'm honestly confused.  
edit: also seeing ftm, i get very jealous. i don't know why but i just do.",0
