temp_id,text,dysphoria
4692,"ok, here it goes: i [15f] think from what i know im bisexualbut my preferences switch to the point where im confused. so, some days i have a super strong preference to men and little to no preference to woman. some days, i have such a strong preference to woman to the point where dating men sort of disgust me? when i think of dating, i dont feel any sort of pleasurable or happiness from it like i used to. some days i feel like it would be best for me to be with a woman. but sometimes, i want to be with a man. what even is this feeling? am i just straight? bi? lesbian? i am confused. has anyone else experienced this before 
i also think i should state that im more sexually attracted to woman than romantically. and im kind of romantically attracted to men and sexually.",0
6491,"i feel like i'm pretty complicated and it's kinda rough. i'm attracted to females exclusively, and not males. but, my (genital preference?) is reversed. i'm kind of grossed out by female genitalia, and attracted to male. so it would essentially be impossible for me to be attracted to a person as a whole. and i'm not interested in most trans girls either, because they would really have to pass convincingly for me to be attracted. so i guess i'm just doomed. fml ðÿ˜ƒ any ideas? i have no idea what i would be considered.",0
18643,"so i met a guy that i really like, but i cannot date him because of the homo/biphobia surrounding me and i cannot be open about my sexuality, at least not right now. just felt like ranting here.",0
1109,/our-work/campaigns/rainbow-laces,0
8661,"i've been struggling with my gender identity for maybe 7 years now and it's getting a bit frustrating. when i was in middle school i realized i was bisexual, which was easy for me to understand and come to terms with. but not long after, i began realizing that i wasn't happy with who i was and it wasn't as simple to figure out. i identified as ftm a couple times when i was younger; i stopped once because of my family's reaction, and the second time because i wasn't sure if i was feeling genuine dysphoria or just a discomfort with the gender roles i felt forced to conform to. i'm not super uncomfortable being referred to as a woman, but it just doesn't feel like what i am sometimes. i think about how life would be if i was a man very often but i really do like being a woman. i present pretty androgynously and get referred to as a man occasionally, and i like when it happens. recently i've been thinking that maybe i'm nonbinary? i don't know much about what that means exactly. i've always just known it was ""being outside the gender binary"" but that could mean a lot of things that i never stopped to think about. if anyone could help me out with some advice or opinions, i'd appreciate it. sorry for rambling lol",0
23975,going out for like a summer camp or going to a dorm and being assigned to a room with all girls. unfortunately i live in poland and look nothing like a girl and have no chance of passing so this aint gonna happen,0
9530,"hi!  first time poster here. just for background, as of this post, i will be a college sophmore.  kinda shocked i made it this far. anyways, to start from the beginning, i was a tomboy. i had previously rejected makeup and dresses and lived in pants and t shirts. i loved doing the whole ""putting my hair up in a hat to pretend i'm a boy"" thing.  i became friends with boys easier, loved sports, but still had a few stereotypical ""girly"" interests.  i thought i had a crush on my older neighbor, and then i realized that it was more of a ""looking up to him like a brother"" type thing.  and he was a dick.  but, i did look up to a lot of women, perhaps a bit too much. i wouldn't look at them, think about them a bit too much, and make stories with them in my head. bit weird. eventually, i got to middle school. pretty much a disaster.  i made a lot more girl-friends, but still identified as a tom boy (or at least boyish).  then, i started learning about all these labels. gay, bisexual, transgender, pansexual, asexual.  a lot of my friends started coming out as different sexualities, so i realized i had to decide on one come high school, i settled on asexual/aromantic.  i wore that label proud, educating people on it, and of course, making jokes. i never really experienced attraction, or at least, i thought.  i still experienced the weird ""looking up to other women"" thing i did when i was younger, and it didn't change. at least the ""incorperating them into a child's story"" stopped.  but i digress. i still never felt any ""real"" attraction to peers.  i was more interested in video games and honing my writing skills.  i only had two guys confess to having crushes on me, and i told them the truth: i thought they were like my brothers.   then, in college, i realized that it was completely normal for 14 year olds to not experience sexual attraction. and that probably, i was repressing it.  or maybe, perhaps, i was right all along.  so here i am.  labeless and confused.  what should i do?",0
17449,"hi i hope its okay to kinda vent here. lately i feel actually scared to meet a new guy n have a relationship. i thought i had a preference for men i feel its not the case anymore. ive been hurt by them emotionally n physically. i feel its just starting to catch up to me all the bad things theyve done n it makes me freakout thinking ab it. i dont want to have a man ever touch me again. like i was at a party yesterday and there was alot of straight guys there. and i was just so uncofortable for like no reason. i just wanted any guy talking to me to stfu n leave. idk maybe its cuz i was drinking cuz i can get kinda annoying n bitchy at guys when i drink. but still they bothered me sm. one dude kept following me around too. n i just hated it. i hate them so much. idk if this feeling will change. maybe ill switch up to lesbian cuz i cant do men anymore like i actually feel scared, even tho its kinda od paranoia maybe..",0
6387," i am more confused than a chameleon in a bag of skittles. disclaimer: i am dyslexic, so there may be some spelling mistakes, or this post may be a bit confusing. (i have tried my best to make it as easy to understand as possible )  i am a gay 15f. i have been questioning my gender for months now, and i have concluded that; i am not cisgender.  however, i don't know what this gender might be.  some clues? * i am pretty sure i have one gender, but it sort of changes.
* my gender switches between nothing, something close to the male, something close to the female(very rarely), and something else entirely.
* these genders don't really overlap. 
* i feel most comfortable with they/them pronouns. however, i don't mind he/him pronouns. 
* i mostly experience gender euphoria, specifically when people think i'm not a girl or i wear guy's/androgens clothing.
* i do experience some dysphoria regarding my chest. (i bind my chest ) as well as my hips. 
* i do not experience any dysphoria with my bottom half. other things that may or may not be relevant to my gender, idk. * i don't know if this is relevant, but i obsess over my hair length. my hair looks like a grown-out pixie cut, and i start to freak out when it gets long; because i don't want to appear feminine. 
* i despise dresses and most feminine clothing. the last time i wore a dress, i had a panic attack.
* i've taken literally every quiz/test on the internet, and the most common results were; genderfluid, transgender, and nonbinary.  if you managed to read this far, thanks. any advice helps. \\ (¢â—¡¢) /",1
14521,where do i find other cute lesbians or wlw people who arent toxic. i swear there are none in my town ðÿ˜­,0
14514,i just wanted to post this here because i thought it was funny! thinking about it like this made me a lot more comfortable with my body! hehehehhehehehehee,1
10301,"this is an unorthodox problem, and may be one unusual for this forum. i assure you that this isn't some elaborate troll indistinguishable from a genuine kook. i associate my self-image as that of a japanese nekomata, fursona, persona, whatever you want to call it, it's what i see myself and associate as. i have several cat onesies, and i wear them quite often. i often spend long periods of my free-time thinking deeply about my sexual orientations and fantasies. which is where i've come upon today's problem. i thought that it's a little unfitting to bring sexual questions anywhere else. i think i might be attracted to beings that are outside of human comprehension. i'm not trying to troll you, i'm being honest with this. i feel no attraction to most people i spend time with (with two non-reciprocated exceptions) and i was wondering if this, the most fitting sight for these kinds of questions, knew if it was unhealthy to find oneself attracted to the idea of a greater being possibly outside of 3 dimensions (ie; cthulhu, or something like that.) it may seem strange but for quite some time i have found this strange attraction to be plaguing my sexual fantasies, and i was wondering if it was abnormal and possibly unacceptable to find myself sexually attracted to a higher entity. i'm not attracted to any entity sighted as an *actual* god, but merely the idea of a higher being, beyond human comprehension, and most likely of godly interpretation. any nondescript incomprehensible being will do, be it yaldabaoth, shub-niggurath or the big whatsit. but at core, i find myself attracted in an oddball manner to any one of these incomprehensible horrors. i often find that my sexual fantasies surround the idea of, a projection of myself taking the form of the japanese nekomata or cat girl, being sexually pleasured by a higher being, and being completely confused, yet pleasured beyond understanding. these sexual fantasies pop up when i come upon them, and they seem to be either some sort of strange current fetish, or, in a worst case scenario, something wrong with my brain. i would very much enjoy feedback on this topic, and would like to hear what you all at r/questioning have to say about this situation, whether it's unhealthy, completely fine, or irrelevant.  
",0
15083,"i am poc lesbian and i haven't started dating yet because i only recently came out this year and i'm focusing on college and working. i was wondering what the dating experience as a poc wlw is like and if you find more difficulties dating as a poc. this is the only thing i've been worried about dating wise tbh, as the dating pool as a lesbian is already so small it seems like being poc would lower it even more because i'm not a conventionally attractive white woman.",0
11686,"(sorry for the wall of text in advance) sup, reddit? i've always identified as straight. but lately, i've been identifying as straight to everyone else, while identifying as a closeted bisexual to myself. i have a girlfriend, whom i'm absolutely head over heels in love with. but lately, i've had gay fantasies crossing my mind. in my own head (not out to anyone really yet), i identify as bisexual. i've never had any overtly gay encounters with other men. i've met a few on cl that have given me head, eaten my asshole, and one even encouraged me to make out with him (not bad, he wasn't my type, but for a first m2m kiss, it wasn't bad). i've never done anything in line of giving head, or bottoming. though, in my fantasies, i increasingly wish to do so. it's gotten to the point that i've been browsing my local cl listings for m4m ads in my area-just in case i lapse and decide to cheat. i don't want to cheat on my girlfriend. but i don't even know if i'm gay or straight or bi or whatever. she knows i enjoy wearing thongs/lace/lace thongs and that i enjoy toying my own ass. i love my buttplugs and i love wearing them for extended periods of time. but she doesn't know that i have some degree of attraction to other men (or rather, other men's cocks and asses). i don't want to put my relationship in jeopardy by coming out to my girlfriend (and even though that's the best idea, i have no idea where to start). i have been considering (i know i'm an undeserving asshole of a boyfriend for even considering such a thing) finding a discrete male locally to experiment/toy with while my girlfriend is at work, in order to fully cement in my own mind my own sexuality (as i have no clue how i truly identify). i would play safely and as securely as possible. i don't want to cheat. i feel as if i would rather break up with her than cheat. we've been dating for almost two years now (two years in october). it's stupid for me to ask if it's cheating if it's me trying to come to grips and figure out my own sexuality, and it's stupid of me to consider cheating on a woman that i love and i know loves me-especially with a man. i have no clue what to do. i know i love anal play. i've brought up the idea of pegging to her and she doesn't seem that enthusiastic-although she was as supportive as i could have expected her to be. i can't expect her to let me circumvent the bounds of our sexual relationship as defined by our monogamy in order to fuck around with a guy that isn't her, i can't expect her to understand that i'm still not sure what i want in my life (or my ass). what does /r/questioning recommend? i don't want to die without having experienced the other half of the kinsey scale, but i don't want to lose the woman of my life either. i love her, and i want to fuck her-every day-for the rest of my life. but i also want to fuck other men (or at least, i think i do). funny thing is that i'm thinking i'd be classified as a vers. i've emailed a guy on cl tentatively about ten minutes prior to writing this. i'm really wanting to move forward with my experimentational plan (he hosts, condoms would be used, i will not swallow his load, although i expressed interest in giving head), but at the same time, i don't want to upset my current relationship. i'm confident that if it didn't work out, i could take it to the grave, and if it did work out, i could also take it to the grave in the event that i weren't ever able to force myself to come out as bi/pan. i'm willing to live with myself, although i don't want to. and i'm scared to communicate with her as would be necessary. i wouldn't even know what to say to her if i did decide to come out to her. i'm scared she'd leave me (which is not ideal, considering that we share a place/rent/expenses, and since we just moved and she's the only one who has a job, she'd be paying for the expenses, and if things went south, adding a break-up to that would just be terrible). what do you recommend, /r/questioning? i do apologize for the wall of text. but i want to suck some cock and have my ass fucked, without losing my girlfriend. **tl;dr: want to experiment outside of heterosexual relationship of two years. love girlfriend (want to marry her and watch her carry, birth, and mother my children) and would die if i ended up hurting her if she took my issues the wrong way, but have been having homo/bisexual urges that i want to act upon.**",0
12472,"hail lil nas x, have a great weekend.",0
27918,"hey yall. i have been wondering this for a couple of weeks and just wanted to get your opinions. im a gay cis man, and the majority of my friends are part of the community as well. one of my friends (sarah) corrected another friend of mine (duane) the other day because, while talking about one of my female friends (dana). duane used they/them pronouns for her. we have friends that use they/them pronouns and im used to using/hearing them so i didnt really think anything of it. but sarah seemed really offended for dana, and vehemently corrected him. i was under the impression that they/them pronouns could be used for anyone, including those who use she/her or he/him, and im just looking to get your opinions. my friend group is kind of split on the issue, but the majority of us are cis and probably just dont understand (im including myself in this). looking to be educated. thanks yall!",0
24234,omg i just used faceapp for the first time in forever and it somehow registered me as female! im literally over the moon rn!! im not sure how this happened because im pre everything and i dont think my face is anywhere near passing but its nice to have that euphoria.,0
9697,"anyone else feel this way? kinda hopeless, like things will never feel right with anyone you meet? or like you can't trust your own feelings.",0
27159,"firstly, i want to mention that this is in no way meant to be a joke or offensive.
    growing up my parents really didn't have any obvious political or societal biases really. so as i grew up i built my own ideas, and on the topic of gender, i lean towards the traditional 2 gender idea. this didn't used to bother me, it was my personal opinion that i mostly kept to myself. but recently i've been thinking more about it, and i realized i just don't understand gender identities. 
so i suppose what i'm asking is if anyone could, not necessarily change my mind, but help me understand the other side more. 
thanks!",0
3707,"hello, hi! 
so i guess i should start by saying that im a cis gender female, bisexual and 16 years old! as well that i am questioning my genderbut in a confusing way. i mean i think ive been questioning for like 4 years maybe? but its more on and off then anything, like ill think about it for a week or few weeks do a lot of research on it and then i wont for a while unless i do for a couple of moments. but when i do think about it i always end up disregarding it after, thinking that no ill just stay a girl even so the whole process of transitioning will cost a lot and itll take a long time, (im not so patient) and what if im wrong? what if im not even transgender and made the wrong decision? as well telling people close to me will freak me out!!!
.
i am known to make impulsive decisions honestlyand changing my mind and such.  (which i might have adhd, my family members say i act like i do and my therapist said i might. im going to get it checked soon)  however i always thought that wow i hate how they see me as a girl sometimes.  (tho sometimes i was glad that i was girl cause then i wouldnt have to do specific things like clean the patio or backyard on a sunny day and my brothers would do it since they were guys. it pissed me somewhat off but i didnt mind cause i didnt want to do that with my breast that felt so uncomfortable when i did such things”i wish i could go outside without having to put a bra on or could just jump and run around without holding on to my breast”i hate them at times)  i mean. i want to be seen equal in a way? not sure but its not like i mind being a girl i mean i like being girly sometimes but sometimes i like dressing like a dude”
however the thing with dressing like a guy makes me think, would guys find me attractive? would i seem lesbian? being a female i feel like i have to dress more feminine to be with a guy
and as well i dislike my body. maybe i think if i had a body that  i liked (female) and got into the shape, i wouldnt feel so bad about how i look? maybe ill know for sure that im a female. 
but sometimes i kinda just want to figure out who i am quicklyhonestly i dont want to be 40 and think, oh! im a guy. 
i know thats okay and i know people have been through that but i dont want to go through thatnot in any inconsiderate way. 
however if i were a guy. 
i would think that i either could be an attractive one or not. 
which is another thing. i would want to be an attractive guy not unattractive. if i was unattractive id probably want to be female again. (or not) 
i tried dressing with guys clothes once, my tits were hard to hide haha which is why i hate them cause there pretty big. i bought a binder once and it kinda worked but it didnt fully made it look like i had no tits, plus it was a tad uncomfortable.
its comfy dressing like a dude and stuff, i as well own boxers haha.
dressing like a female is nice too. 
i like dressing like both. i would love no chest but i feel as if im a female with no chest that be kinda weird. what guy would like that? female? if i were a guy with no chest a girl and guy could like that.
the thought of being a guy crosses my mind a lot. i like the idea of just being the man in the group of my female family members. to my female friends. 
if there was a button that said if you could turn into a guy right now. would you press it?
you cant go back. 
i would think that, that would be challenging. it shouldnt be huh? 
i would think would i be attractive? would i be risking it? i shouldnt care about my looks but i do.
but i would have no chest. i would have a penis. short hair. i would be a guy.  . i would press it. 
long time to think about it but i think i would press it. the idea of being a guy around people and the way they would treat me makes me feel good.
idk. im confused. transitioning is a lot which is why i always just decided to stick with the gender i was given. i dont want to make any mistakes. 
i make a lot of mistakes.
as well when i comes to my sexuality, i am into both genders but more into guys. (the reason why i know im into both genders is cause girls do have a way of turning me on) 
but if i were a dude. i would probably see myself more with a guy then a girl. probably gay but more of a masculine type. 
maybe its the idea of it 
+ive also tried pretending to be a guy online, and searching up videos. seeing how people figured themselves out and how transitioning was. i also asked myself questions but transitioning and mistaking myself always stopped me. plus the idea of how my family would react if i said i was transgender. i think id be the first. i never told anyone i know about these thought except my best friend which im comfortable with telling her everything. she said she would accept me and that it would be great. being her friend as guy would be awesome. 
what scares me (again) 
mistaking
transitioning 
reaction (family+friends)  does anyone else relate to this? also ill appreciate some advice and such thank you for reading. ps. i know im not gender fluid or such. personally i feel as if i would either go by she/her or he/him. thats it. also my bad if i sound inconsiderate. i dont mean too, i just didnt know how else to word how i was feeling. double ps. im so sorry if i keep repeating my self and this is so long and just scrambled everywhere. im trying to express my self and put down all my honest feelings but i had so much it was hard to do it where it was more neater. again apologies.",1
3041,"hey, i spent years wondering if i was bi or pan. neither fit how i felt, and yet there was no other options, or so i thought. and it was killing me. that was until i accidentally stumbled under the defintion of omnisexuality and i instantly realized that it was the one label i was searching for all along. it toke me that long to discover it because of how obscur it was. i also discovered polysexuality, that is just, if not more obscur than omnisexuality. they are probably so obscur because of their similarity with bisexuality and pansexuality, but for some people like me, the difference matter. so, i'm doing this post to inform some people about these two sexualities, maybe help some find a label they are more comfortable with. omnisexuality:  being attracted to every gender, but unlike pansexuality, not being genderblind to it. gender can be a factor in your attraction, but you are attracted to every gender, even if you may have prefferences, and you acknowledge it. polysexuality: being attracted to more than one gender, but not all of them. unless bisexuality which is being attracted to strictly two genders, polysexuals can be attracted to a lot of different genders, but not all.",0
27295,"the one i've found are insanely priced. which is fine, if you've got the cash, but unfortunately i do not.",0
5015,"so, that's something that cross my mind every now and then. i get bothered or i start overthinking on things that shouldn't even matter and i see people who don't even think twice about it. i just feel like i'm so self aware for so many things compared to the majority of people. but on the flip side, things that i should be stressing about don't affect me as much. i'm just confused and looking for reasoning behind it. thanks in advance!",0
8820,"feel uncertain about myself. 33 year old male. just need someone to be honest but nice to me. causes me anxiety and nerves. not public, too embarrassed. just need help.",0
13882,"i need to convey that i'm female and lesbian (i'm a trans female btw) but i don't know if i should wear wigs(i own 2 wigs). there's no other girls in my school (yes i still go to school) with hair that's as short as mine and i can't represent my gender/sexuality in the way i dress as there is uniforms so i'm constantly misgendered and the fact that my voice is still not good and it's really hard to fight the growth of my vocal cords due to the fact that i'm not yet on blockers(i will be soon).  so i'd love advice on what to do, should i wear my wigs, should i be more aggressive in how i correct people (i correct people constantly and not many people listen, but to those who do thank you), what should i do? alt question: how are y'all doing today did  cool or something like that?",0
