temp_id,text,dysphoria
14141,"i havent dated in 5 years, and i finally put myself out there. on a whim, and met someone so awesome. 
everything clicked. from sex to sense of humor and even hobbies. 
we only made it to 2 months before she broke it off. she was in love with someone she cant have and i was just like a crutch i guess. 
it hurts, but it would have hurt more in the process.  i feel like im back at square one. like i finally let someone in just to be hurt again.  i dont even know what to do besides cry.",0
11019,"hi everyone. like the title says, i'm a 20 year old girl and recently i've been questioning my sexuality. i grew up always having crushes on boys, however i never had a boyfriend or even had any boy like me back for that matter. so i went through high school with no sexual experiences whatsoever. i started using tinder the summer after high school, but i never actually met up with a guy from there because i was too nervous. i also never really connected to any of the guys i met on there because the conversations were usually boring and i didn't put too much effort into messaging them. so up until now i've been using it on and off, basically just fucking around and occasionally messaging guys back. i've been on a date with a guy my friend set me up with, but i didn't feel any attraction so that didn't lead anywhere. i've also made out with a few guys while drunk, but i pretty much don't remember even kissing them because of how drunk i was (lol @ my life). so that's basically all the experience i have. i've always thought girls were pretty my whole life, but i always just thought it was the aesthetic. especially for my age, girls put in more effort into their appearance and are generally just better to look at. going on tinder was just disappointing to me because guys usually suck at taking pictures and look better in person.  so, last night when i decided i would try to put male and female as my preferences, just to see. the first girl i saw i was immediately attracted to, and i wanted to swipe right more than i ever have for any guy i've seen on tinder. i started crying and before i did anything i just changed my preferences back to only males. i want to change it back to females again but i'm too scared the same thing will happen.  so now i'm just wondering if i've always thought about guys sexually just because it's all i've ever known. i haven't told anyone and it's giving me a lot of anxiety. i used to go to a therapist for anxiety like this but i haven't gone to see her in a while. i don't even think i would be able to tell her this.  honestly, i don't really know why i'm posting this, i guess i've just been bottling this up and i needed to get it out. if anyone has had any similar experience or any advice or kind words that would be much appreciated. i don't really know what to do.",0
12523,mine is 11 right now. 2 women and 8 men. im not very proud of it because im only 18. im curious where i stand in terms of age and body count.,0
27496,"hi all! long post incoming, but theres a summary at the end ;) im a 33 yr old genderfluid person, something ive started to realize about 1.5yr ago. im amab but have always been quite feminine in my mannerisms, communication style, etc etc, something ive been bullied with or have tried to change to conform to expectations for most of my life.  anyway, im married to a straight girl from a small-town conservative family. shes still getting used to the fact that im expressing myself more femme when i feel like it, but shes trying to be supportive. actually, almost everyone i know had been super awesome about it, and apparently my coming out wasnt much of a surprise to many people (often heard; it kinda makes sense). the exception: my wifes parents. they live in a small village in a part of the country thats very homogenous in terms of culture and ethnicity; they even speak a different local language. (frisian, a minority language in the netherlands. fun fact: its the language thats most closely related to english). so, when i came out last year, they were very concerned about their daughter, and asked her questions and made assumptions like: -how could she be happy like this?
-i would never be able to find a new job.
-obviously this meant i didnt want children.
-men wearing makeup is disgusting.
-i probably waited until after my dad had passed away because they figured he wouldve had difficulty accepting it. (actually i know he was secretly into crossdressing, and i wouldve loved to share it with him). yeah. luckily my wife was also like: wtf!? we had some talks with them, and they now see that, while they still dont understand it, at least im still the same person, and my wife is (mostly) happy with me.  but, of course, the holidays meant visiting them.  usually i kinda dress in a way that makes me feel confident- whether its more masc or femme depends on the situation and my mood, although i prefer looking cute with some makeup, leaning towards feminine. especially for an occasion such as the holidays i want to feel okay and not dysphoric or anything...  so, whilst planning stuff for the visit, my wife asked me if i would please present masculine, just wearing trousers and a shirt or jumper, maybe only light makeup -at most-. when i asked why, she explained that she didnt want her parents to feel awkward, which would also make her feel awkward as a result. she felt quite anxious about it... which i totally get, as i also often struggle with what i feel comfortable with in which situation; and it can be scary to face people who might react negatively to your appearance. this lead to a discussion and quite an argument in the end though: i explained that, of course, i would dress in a way that i would feel would be okay, but that i wanted to also be able to do what feels okay for me. if i always dress in a way to not make people uncomfortable or confused or whatever, id never be able to do what i want (ive done that for about 30yrs already- conforming to gender expectations). she countered by saying that everyone plays roles sometimes and dresses appropriately according to a situation- and that it shouldnt be a big deal to just wear something i often wear.  to me, it wasnt so much the actual wearing something more masculine, but in the end, i guess it comes down to acceptance and being able to be myself. in the end i just wore some jeans and a random (masc) t-shirt that i felt okay in, but it did leave a sour taste... i was wondering if/how others deal with this. it feels kinda shitty that my wife basically asked me to pretend im not genderfluid, but i do get where shes coming from, as she just wanted a fun night with her family without any fuss or awkwardness. yet, this did mean it made it more difficult for me. i teach classes on gender and sexuality to teens, and im aware of the importance of exposure in changing peoples ideas. so if im always hiding that part when im with them, theyll never learn and be okay with it... tl, dr: im genderfluid, in-laws are conservative, wife wants me to present as my assigned gender, i feel awkward about it. anyone have ideas how to deal with this?",1
23268,"hey y'all. i was just wondering if anyone has any tips (grooming, makeup, etc.) on how i could subtly make myself more feminine looking. i already am pretty happy with my hair but it's the rest of my face i'm unsure of",0
6650,"i don't know if i feel female or male or both or neither. i just know that i feel like myself and don't feel super uncomfortable with people perceiving me as my agab. though when i look in the mirror i see a guy or a gender nonconforming person. only time i look in the mirror and feel like i could tell myself i'm a girl is when i'm wearing makeup and even then while looking myself in the eyes i feel that im not a girl and that i'm non binary st heart. i simply feel neutral or like i would look better as a man, though i often try so extremely hard to fit into the expectations of what a woman should be, that i might get offended if someone calls me manly and i know they don't mean it as a compliment. does this make sense????",1
10965,"i made two posts here before but the second one got no comments on it so i've sort of remade it. i honestly just need someone to talk to bc no one around me understands what's going on. basically i'm 14 (almost 15), a girl and confused as hell about my attractions. i gave myself some time to think about my attractions after i made the first post and came to the realisation about certain things. 
when i was younger i assumed i was straight, since i hardly knew what being lesbian was. i made friends with the boys at primary school and had almost no girl friends. i didn't see any of the boys as attractive or cute, i saw them as brothers and friends only. because i had no social skills with girls, when i went to an all girl secondary school, i was stumped.
i found it hard to make friends as i never liked other things girls liked. i i don't like makeup, fashion or 'cute' things, i like action films, history and video games.
i made a few friends over the span of three years, mostly girls who were kind and accepting and didn't mind if i had completely different interests. i started questioning around this time. i believe it was after there was drama at school because one girl was being blatantly homophobic in front of everyone. when i told my mum about it she told me that there were hundreds of people like that and we just have to ignore them. she then asked me if i liked girls.
i shook my head because i couldn't come up with a definite answer on the spot. that's when i started getting confused. 
now onto the more technical parts;
i have had fantasies about heterosexual sex, most of them quite satisfying. but the idea of a penis? ew, no get it away, rank. i just find them really gross to look at. when i'm having one of 'those' moments, i get turned on, but if i imagine the actual penis? i get grossed out and it ends. i don't know if this is because of myself imagining an orgasm? perhaps the movements involved are what get me on?
i also don't find 'hot' guys attractive. i will admit (embarrassingly) that i have gone on the internet before and looked at pictures of hot dudes to see if i like them. but whenever i see a shirtless guy with mad abs and muscles i'm just like ""for gods sake put your shirt back on"". i never get aroused by them. i also have never thought of a guy as cute. 
if i see a guy who his stereotypically cute or hot, i recognise it but don't think it myself. i just go ""yep, he's hot by girl standards"". 
i also cannot imagine myself in a serious relationship with a guy. 
i just can't.
a girl on the other hand?
yep. definitely.
this is when the 'guh guh guh gayyy' stuff comes in. 
i have been aroused by images of girls in the past, although find it slightly harder because i don't know how lesbian sex exactly... works? 
if i see a hot or cute girl, i notice her. i think 'wow she's beautiful'. 
i've imagined kissing a girl before, and i get all fuzzy inside and hot. it sort of relaxes me. kissing a guy? meh...
it doesn't spark that feeling i get with girls. 
if i imagine myself in a serious relationship with a girl, i can imagine it perfectly. whenever i picture myself in a romantic relationship with a girl, i'm also fuzzy inside.
is this normal? i feel sexually attracted to dudes (kind of) and romantically and partly sexually attracted to girls.
i don't know what's going on! i wish i was just full on straight or full on gay, i would feel a lot more comfortable with myself.
just asking for advice and suggestions.",0
23576,"hey y'all. i've come up with this master plan to cosplay as a female with minimal suspicion and i want to know if y'all think it'll work. okay, so some of my friends recently started a d&amp;d group and i decided to make my character a female elf. my idea is to convince everyone in the d&amp;d group to dress up on halloween as our characters, giving me the perfect cover for publicly presenting fem. thoughts?",0
12563,anyone know of a lgbt friendly waxing establishment in north carolina hoping for the greensboro or raleigh durham area.,0
10531,"hey there, what happened to me in the last few days may be a known story. maybe it's not. i don't know. what happened was that i somehow ended up in r/egg_irl from an unrelated post. ever since i looked around there, i'm starting to doubt myself quite a bit.  usually, i'm a status-quo person. i don't often question why things are as they are. i'm male, that's just how it is. but it's not like i never had any signals that i was a bit questioning. from very minor signals like instinctively playing female characters in video games (even if nothing but the pronouns change), to subtle ones like being genuinely jealous of the girls in my friend group for having many more fun and beautiful clothing options. so visiting r/egg_irl hit way too close to home for comfort.  however, as much as i am questioning about these kinds of things, i do not dislike being male. i am not dissatisfied with my body, and i do prefer a fair bit of facial hair. yet i want to keep my long hair, and admittedly get remarkably giddy when it happens to fall into a more feminine hairdo. so it's not a particularly pressing matter, i am not unhappy. but when i saw i could cross off 10 spots on [this image](), i did start wondering whether i'm actually completely cis. i don't think i'm completely trans either, maybe it's just a genuine feeling of novelty to have discovered more people with that same ""wondering"".  anyhow, i'm curious as to whether i should stray away from ""the status-quo"". whether i should try to act on these feelings. or just to find someone to talk to about it. thanks for reading!",0
15746,reposting from another sub 3 this is completely uncharted territory for me so please be gentle 3 i dont know if masc lesbians prefer to be called something other than beautiful/pretty/whatever . like are there better words to use when flirting/courting? or am i thinking too hard about it? please help,0
8989,"there has been a lot of stuff bothering me lately. i've been posting about things like this a lot. i'll try to keep this short. i worry about a lot of things. i only have one more semester before i graduate college and i am scared about that. i also have no social life and i'm worried i'll be lonely for a long time, maybe forever. the thing that has been bothering me the most though is my sexuality. i just seem to be scared of it or something. i don't even know what my sexual orientation is. like i said i don't have a social life, so i don't have many friends at college, but there is an old friend of mine from school that i think i might be attracted to, but i can't really tell if it's genuine. that's just a brief explanation. anyways, like i said, i've been posting about this a lot lately and i feel like i've sort of been obsessing over it and it's making me feel pretty shitty lately. i guess i just think that maybe more of a one on one conversation would help me a little bit more. if anyone who's gone through something similar would be willing to pm me or offer advice i'd really appreciate it. i don't know how much messaging a stranger over the internet will help me i just feel like it might help to find someone to ""talk"" to, but i probably won't respond right away. i've been posting a lot about this recently and i sort of feel like i've been posting too much on this sub lately.",0
11680,"i've always identified as male since i was raised a boy, although i've hated the idea of masculinity ever since i first started to notice it restricting me. that dislike has only become stronger as i've grown up (i'm 23 now). i hate the concept of being a ""man"" and everything that i associate with that, but i've also realised those feelings are mostly centred specifically around what masculinity means to me and i'm indifferent to the idea of being like, a ""male person"" or even a ""boy""? i'm also indifferent/feel positive about female/feminine associations. occasionally people ""mistake"" me for a woman and then are really apologetic but i actually like it because it means in some way i'm coming off as more feminine than masculine. to be honest the idea of having a gender-ambiguous appearance and just occupying my own individualised transient gender space is really appealing to me, but at the same time--and i suppose this is what's stopping me from validating and actualising those feelings properly--i still know that i have benefited from male privilege my whole life and surely taken on at least a little bit of that socialisation. i've still needed schooling on feminism, gender, transphobia, etc.. because i've had the privilege of not having to deal with a lot of things firsthand. so even though i passively hate the idea of being a man, i'd feel like i'm being unaccountable for that privilege if i were to actively reject being identified as one? ughh compicated. sorry this is probably kinda convoluted. i've been trying to make my gender identity clearer to myself as i learn to accept myself but i get stressed out trying to work this out!",0
11025,"i [18f] will preface this by saying i've never had sex before, so perhaps things might clear up a little more once i do. romantically, i've know i was bi since puberty. ive had very intense crushes on both men and women, including fantasizing about cuddling, hugging, kissing. occasionally i also think about sex with my crushes, but only in a this would be very intimate kind of way, not a this turns me on physically kind of way. sexually, however, im very confused. im suspecting im somewhere between heterosexual and asexual. i do masturbate, and mostly to straight porn. ive tried watching lesbian porn, but ive never been able to get off  to it. sometimes i masturbate to sexual fantasies as well, but i never think about anyone i know--just a vague male figure i make up on the spot. in fact, when i try to get off to some person i know irl, male or female, (even people i find attractive, like my crushes), it just feels sort of uncomfortable--killing the vibe and leaving me unable to orgasm. its very confusing because i want to finally come out to someone and be able to flaunt my sexuality--however, im not sure what to come out as. sometimes i feel i should be bisexual, but i feel sort of phony labeling myself as such, as i have no sexual attraction to women whatsoever. other times i feel i might be asexual, but i masturbate and have sexual fantasies, and i'm open to having sex, even if just for the intimacy. however, just labeling myself as straight doesnt seem true to myself--especially as i find romantic attraction to be much more important than sexual attraction. what would you call me?",0
15018,anyone else feel like finding out they are a lesbian was more like how repressed memories surface”they are always there you just havent looked at it or brought it to consciousness yet. i feel like ive always known i was a lesbian but here i am 33 years old and reeling at the realization that im gay. its so obvious to me now but it still took me so long to get here. its like a parting of clouds and its so clear now.,0
16332,"i am dating this girl and i like her and everything but (and i know it's rooted in the heteronormative society, patriarchy, the way that we teach girls to interact with other girls and such, but that isn't the point) but for some reason most of the time in our dates when we talk and do things together i feel like i'm just out with gal pal. my brain just doesn't recognize that that is different than going out with a friend even though i like her. if course it's not like that when we hold hands (although sometimes it does feel platonic) or when we kiss (this obviously doesn't feel like a friendship thing) but when we spend time together, i want to make things more romantic, at least from my point of view. especially that we are both femmes, we talk about many things, among some beaut hacks or hair or sth like that, which is maybe not a very ""date thing"" in a straight relationship, but i feel like when 2 girls go out it's an interesting topic that we have in common. so. what do i do to be more romantic? it's not like we will make out constantly to keep the hots alive?!! pls help",0
8983,"i dont really even know where to begin with this.
im not sure if im confused about my sexuality or gender or possibly both?
i am a female and currently identify as a lesbian, came out a few years ago. never really enjoyed sex with men, never enjoyed kissing them etc. just overall felt bored when i was with them.
i am very attracted to girls, they give me feelings men never did.
however recently ive been thinking a lot about how i would probably enjoy being with a man if i were also male?
i keep also thinking about how much i wish that i didnt have breasts and looked a little more boyish, not completely though, there are feminine aspects of myself that i do like, but a part of me feels like i want to possibly be somewhere inbetween male and female? im not sure why i am feeling these things but i feel like recently these thoughts are taking over my life a little. as a female i cant imagine being with a man, only a woman, so why do i then have these thoughts of wanting to be with a man but only if i were male? sorry if im rambling/making no sense was just wondering if anyone else has these kinds of thoughts?
am i just overthinking things? thanks for taking the time to read this mess haha",1
27434,i don't feel male or female even though i am pretty feminie and that gender was assigned to me. but i never felt like i had to change my identity. i like my first name and even though it's feminine i like being called by it.   but now the not so awesome stuff: i have huge problems with my body image. i do feel like i am in the wrong body but that in the weirdest way possible. mostly i hate my face. on some days it's too feminine for me and on most others it's too masculine for me. mostly people tell me i look cute but that always rubs me the wrong way. my father looks very similar to me (i have no traits from my mother) and i see him and his gender when i look in the mirror. with loads of makeup i make myself more feminine but i feel very uncomfortable with it. when we are in public together there are a lot of comments like ''wow you guys are so similar lookwise''. also i hate my pretty feminine body. i wear loose clothes every day and  when there is attention on me i always believe that people must think that the proportions are off. i feel fat all of the time because i am very apple shaped. if i could choose i'd have a skinny body without any curves.   sorry for all of the rambeling. i don't know if i shoud identify differently or if i just have dysmorphia. what do you think?,1
23700,"it's something i find very odd, i post a lot of pictures of me on chats and i'm always wearing makeup, lipstick, and a dress. but still some people think i'm ftm when i state i'm trans. does it have to do with the stuff i talk about? i enjoy talking about vintage tech (crts, vcrs and all that shitznit). is there such a thing as 'male' interests?",0
2834,"help! attracted to anime boys? for a long time ive watched a lot of anime and i usually find a lot of the girls attractive, but recently theres been times where i think a guy in anime is attractive and i feel awful when that happens.  im a guy so i shouldnt be finding myself attracted to a portrayal of a guy.  how do i stop this?",0
20016,im 18 male and have never been in a relationship but im questioning that i might be bi is it normal to feel this way never going out with someone,0
28515,"howdy, guys. so, a personal thought battle has been bouncing in my head: and i genderqueer, or am i a gender non-confirming man? i used to be adamant about that, saying i was still a cisgendered man, as i took on more femme qualities. i wanted to make a point that ""man"" was arbitrary, and it doesn't mean i *had* to be a certain way. what i hate the most is male gender roles: the expectations, the ""supposed to's."" i ""didn't want to"" be genderqueer, because i felt like that was ""giving up,"" and admitting that because of my preferred form of expression, i was not a man; that a man *is* this certain set of traits and gender roles. now, i reflect, and feel a bit uncomfortable with the term ""man"" (but not ""boy?""), as well as ""woman."" i guess what i should just get to is the questions i'd like to ask other people: if you're gender nonconforming, but not genderqueer, why don't you feel genderqueer? vice versa? and what i would be very interested in hearing is gender nonconforming trans people: e.g., butch transwomen and femme transmen. what is it that makes you sure you're a gender different from you were assigned at birth, yet maintain traits of that gender? it's a bit a mess of questions, but that i'd love to hear input on that blurry line!",0
728,how about a gbt subreddit that is about drag and ballroom culture im sure there already is one for drag  but i dont think there is one for ballroom culture if there was that  would be mad cool,0
