temp_id,text,dysphoria
27380,"i haven't had to worry about correcting people in a while; a year ago i moved out to the queer district of a liberal city where no one knew me before and people mostly just got it, and before that i was correcting people as an ostensibly binary trans woman which was super easy. (well, easier) i moved away from where i grew up and got a whole lot queerer, but three weeks ago i moved in with my parents and... it's been uncomfortable. everyone still wants to use he/him or (much more often) she/her and i'm realizing i feel like i can't correct them anymore. with she/her it was different; i pretty much knew people would take me seriously and get the idea when i said it, but that certainty evaporated when i came back as something less neat and conforming. most people just won't get it, i know how cis (and many trans) people talk about us, and even when they're supportive they don't think about it the same way as they do with binary trans people. i can't correct them because now its superficial. i'm not a ""woman trapped in a man's body"" anymore; i'm something less serious and important even to the people who i know will go along with my pronouns. i can read it way too clearly on their faces, and that might honestly be more painful than them getting it wrong.  the real reason i don't correct people though is because if i start doing it i'm also starting a timer until i hit a snag. i'll always be waiting on the other shoe to drop, because it *will*, (and probably quickly) when i finally hit someone who'll make it a big deal, someone unafraid of announcing that they just don't get it and challenging me. in that moment i'm not going to have the wherewithall to be an educator, and that'll cause a lot more pain than the sum total of misgendering. so i shut up and take the she/her lumps i asked for, i guess. i... don't really have a point here. i'm just upset.",0
10064,"im confused and unsure. im biologically female attracted to females. i prefer feeling masculine and try to be as masculine as possible. i feel really gross about feminity and its subsets applied to myself. im unsure if i'm just lesbian or if its something more. im scared to try to actually transition or come out to anyone other than my best friend (its pretty obvious though from my physical appearance).  transitioning would be permanent and irreversible but i hate living like this. the thing is i might hate living as a male more if im wrong about this.  another problem is that as it is i'm mainly attracted to lesbian women. not straight women. i could never be biologically a man and it would cost a lot. id always have scars and my genitals would always appear mutliated and small. right now i try to lower my voice, i only wear mens clothes, and i have a mens haircut, and i wear sports bras only. like i said, i havent outright told anyone about this, including my parents. only my best friend knows im attracted to females. its just not enough. even though im a masculine girl, no one would ever call me male except by accident. my body is too feminine. i feel so happy when people call me male by accident. but what if its just that? im just a masculine girl and im not a man. by taking this further i could permanently ruin my life, for just a chance at being happier. is it worth it? is there even a middle ground?",1
22128,"trigger warning: homophobia and verbal negativity 
hey virtual dad here checking in.  has anyone told you lately they love you or are proud of you or hey you're doing a great job.  its a simple act to let people know you care but it has a tremendous impact on our mental wellbeing.  letting someone know you love them or care about them can brighten their day.  it can lift their spirits and their mood.  when we know someone cares for us it makes us more energetic and caring ourselves.  when someone tells us we're doing a good job or their proud of us the quality of our work improves.  see letting someone know they're loved and important to us makes a big impact yet sadly most of us take it for granted.  we just assume people know how we feel so we don't tell them as often.   we must tell people they are important to us and they are loved.  so many lgbtq+ kids rarely hear that from their family anymore.  instead the last thing they hear from them were things like...  i don't know why you let us down like that. you weren't raised to be gay.  you've shamed this family and the list goes on.  its funny we're the ones being bullied.  we're the ones facing discrimination daily.  we're the ones who struggle yet somehow it becomes about them.  they forget the child they love is still there.  their sexuality doesn't change that.  they still need your love and pride yet its usually denied.  just know i love you all.  there's nothing that brings me joy like being here for you.  yall are awesome just keep being you.  my dm's are open for everyone who needs me.",0
424,"all of use are humans we all make mistakes but the one mistake none of us have is loving who we love. some people would say buts it worng to love the same gender or more than one gender but that's false becouse love is what we make out of it not what others say it is. so as i like to say inform people and why you love, who you love and maybe why you don't love. we are all human we all make mistakes and we can help those who make the bigger mistakes frist. so be who you are and make sure to be happy with who your happy with. an remember if you need someone to talk to you can talk to me.",0
28541,"for some people, this may not seem like much, but to me, this was a huge step towards affirming my identity. i had abstractly spoken to my boyfriend about how uncomfortable my body makes me sometimes, or how i neither feel like a man or a woman, but never really decided to take action to make myself more comfortable. well, yesterday, my boyfriend jokingly called me a big girl, and it just felt so weird to be called a girl that i asked him to just use gender neutral words to describe me (he said sure, no problem; he's pretty awesome), and i felt so liberated. i may never choose to officially change my name, or my pronouns (my first language is purely binary and i don't want to be the trailblaizer who invents a new pronoun), or have any hrt or surgery, but just knowing that my boyfriend accepts that i'm not his ""girlfriend"" but his ""partner"" is really nice.  i kinda want to gently correct people (like, my friends) if they use strongly gendered words to describe me, but idk if it's worth the hassle of being called an attack helicopter or some other ridiculous thing. does anyone else feel this way?",1
26426,i am a part of the lgbt community and am trying to find my place and wonder what gender queer is,0
11269,"would you like to participate in our 10-minute study focused on validating a sexuality questionnaire? this study has been approved by the university of calgary conjoint faculties research ethics board. this is a validation study of the revised sexuality questionnaire. the questionnaire measures affectional/sexual orientation as well as sexual identity, gender identity, and gender roles. this will include questions about sexual preferences and sexual behaviors toward both males and females in the present and while you were a teenager. you will also be asked to provide your age, biological sex, gender, gender role, year of study, sexual identity, ethnicity, and religious affiliation. you must be 18 years of age or older to participate. this entire study is online, and takes most people about 10 minutes to complete. please visit the following link to complete the study:/se/?sid=sv_bcnp3z3splrtymf if you have any questions or concerns, feel free to contact: * dr. alderson, principal researcher, at alderson@ucalgary.ca * or the conjoint faculties research ethics board at the university of calgary, at cfreb@ucalgary.ca if you are curious about the results or any aspects of the study, whether or not you took part in it, please feel free to contact dr. alderson at alderson@ucalgary.ca 
thanks!!",0
21193,i am extremely attracted to all women. i am not attracted to men; except when i watch gay porn.  then i want to give oral and fantasize about being a bottom.  i think a penis is beautiful. now i want a mmf.  am i bi???,0
27093,"you have a gender queer person, they are afab and female presenting (traditionally feminine but not girly-girl), how would you describe them?  gender queer is about as specific as they can get about how they identify, but they want to be able to express that they are gender queer but also at times it's important to point out they look like a cis woman who fits gender norms in terms of expression (thus in a way a passing privilege). is afab female presenting gender queer what would be used? can femme-presenting work here...or is femme only for lesbians?",0
11453,"i apologize in advance... i tend to ramble. i saw this great post on reddit of this straight 18 year old who was tired of bullies and his parents for insisting that hes gay. well he asked a friend of his why everyone thinks that and his friend gave him an honest response: how he reacts around both sexes. he posted an update where he just seems very confused.  im very much a romantic. and im a 17 year old male, (at least my sex is) and i've thought that i'm straight. i tried visualizing ""kissing"" both males and females... and i think that i could just be affectionate with around anyone if im in the right mood. hugging, cuddling, etc. as long as they're lovely people. i definitely have been sexually aroused by females (or i think i have), but i can admire a muscular/attractive guy. though im having trouble imagining enjoying any anal stuff. i feel like i could just love anyone and everyone right now. im pretty sure ive fallen in love with two girls. ive only ever kissed one. but i have close guy friends who i care deeply about and i think i can just imagine embracing or having non-penetration ""sex"" with them.  im not much one for labels... but that post was very eye-opening. any guidance/suggestions/anything would be much appreciated. id love to answer any questions you might have that you feel would help. thank you. edit: i dont think that im too comfortable with butt stuff with either sex, but i'll have to think about it more. maybe that helps?",0
13943,"i'm a trans woman, and i've been in this subreddit for about two years. i always felt welcomed here, but the last year or so has had frequent ""yay, trans women!"" posts that no longer feel inclusive, but actually make me feel like an ""other"" now. i don't want to be pointed out as different but equal. i'm just a lesbian woman. this subreddit is already known for being inclusive which is why i joined it in the first place - which again - was two years ago now. the more we shout about how we're accepted, the less i actually feel accepted here and moreso just existing here. seriously, most of these posts are by other trans women, too. everyone gets it. we're supported here. why else would we be here?",0
23362,"hi! so, i have this problem that i'm wondering if anyone else has. i really want to just have one name so i don't have to keep changing it. but the thing is, i can't decide because whenever i find a name i like, i somehow associate it with an aesthetic or color, and associate that to a gender. for example, i like the name kitty, but then i associate it with pink of a cats eat and pink has been known as female. i just want a name that makes me happy and not a certain gender. is this a problem for anyone else?",0
9673,"ok, so im a 29 yo male. ive always thought of myself as straight, but ever since i started discovering porn ive found myself drawn to trans porn. specifically, mtf porn with people like bailey jay and sarina valentina. even here lately, im finding myself watching mostly trans porn. i dont know if this means im not straight or what. its very confusing and i dont think my partner would understand.  another issue im facing is(forgive me if this part doesnt belong) that i feel like i identify as polyamorous and thats something i dont think my partner would be on board for. :( so, am i straight? am i bisexual? im so very confused.",0
21067,"im confused because im basically a straight married white male with one exception, i love big hard cocks, i love to suck, stroke and play with them.  outside of that i have no interest in men. i dont feel anything emotionally or physically. when i see men in general. i cant stand the thought of kissing or close body contact with a man. i could never be in a relationship with a guy other than fwb maybe. the only time i feel anything is when i see a cock of a certain size and shape, i want to just get on my knees and worship it. it doesnt matter who its attached too, as long as they have good hygiene are not to hairy or extremely obese. i dont have any hang ups about it, had a few encounters, i enjoyed most and am not bothered in any way by it.  not looking to hook up, just curious about it and would love to chat about it with someone who is also curious and is interested in asking questions about it or knowing how i feel.",0
7258,"hiiii omg so ive been identifying as bi for a little while now but something is really confusing me tbh so ive been surrounding myself with wlw content/media ever since i found out i was bi. basically my entire tiktok is filled with wlw stuff and its just something that ive really gotten into. through seeing all this content, ive seen the word comphet a lot (compulsory heterosexuality). lots of times ill watch videos of people questioning their sexualities or even just saying that they prefer women over men, and many people comment and kind of throw it around and say oh your attraction to men might just be comphet. so basically, ive gotten used to hearing this word after seeing it everywhere. but i think it has a bad effect on me lmao now, every time i feel attraction towards a guy, im constantly questioning whether its comphet. and every time i get even slightly nervous around a girl, i automatically assume its attraction. this is so weird bc this is the reverse of what usually happens to people??? the whole idea of comphet is assuming that anything you feel towards men is attraction but thats exactly whats happening to me with girls rn???? i think i have reverse comphet or something loool its getting really stressful tbfh. i used to be absolutely sure and so happy in being bi, but now im starting to get more and more confused and i think it comes down primarily to that word having gotten ingrained in my mind and me always using it to question whether im actually attracted to guys or not, even when if i felt something that i felt towards a guy towards a girl instead, i would definitely call it attraction. so yeah, this is getting borderline unhealthy and its super weird how hearing this word is having essentially the opposite effect of the words meaning for me lol. idrk what to do to stop questioning if everything towards men is comphet and assuming everything towards women is attraction.",0
2679,"may be it's gerontophilia ,i am attracted to older men only, since i was kid to now (i am 22) when my friend used to talk about girl i wish i could have senior man.never ever dated a real guy for my whole life because of this issue was raised by independent mother .i had once beat the shit of my biological dad while seeing my mother was abused by him.unsuccessfully i could not run away from home cannot tell anyone about my situation because of homophobia out here.thought of killing myself rather than getting stuck in this tapestry but i am too afraid to die too .i once tried to ran away from country to settle to first world but my student visa got rejected .i also started online dating apps and website (including grinder/silverdadies )hoping i will met some guy ,some day but got unlucky when i found then most of them were white guy as a foreigner who seems to be interested only on one night stand or sometime just trying to collect pic of me.simply, i always endup doing masturbation watching some dad and son gay porn .i do get envy of those asian guy who had been through similar situation of mine but later got successed in marrying some old guy. the only easy peasy way for me is to run from my own country that could had cost me alot.i don't know what to do and what not to do.i am bored as well if wish you can pm me too. has anyone been same situation. p.s:sorry about my bad english.",0
16285,"i have a friend that i met while i was abroad. coincidentally, her long distance boyfriend lives in the same city where i am at back home. my friends bf knows about me but has never met me since she hasnt been in town. i am a lesbian and her bf is obsessed with the idea that i am gonna convert her and its constantly starting fights w her over interactions with me. questioning our
conversations or snapchats, everything. he claims that eventually imma wanna be w her. mind you, i have a girlfriend of 5 years with who i am really happy. i told her that she needs to put a stop to it because i am really uncomfortable with his accusations but she keeps making excuses for him. idk what to do. has any of you gone through something similar?",0
29180,i matched with someone on tinder and they identify as gender queer. i've never asked out a person who identifies as such. they are very attractive but i don't know what the hell i should say. i'm used to hitting on straight women but i don't think that approach will work. i don't want to sound like a tool. any thoughts?,0
26179,i've been on hormones for about a year so far and now i've started working on my legal name change. once that's done i'm going to work on changing my birth certificate and other documents. i've been doing all this in secret without my family knowing. i live with them and for the moment i don't have a job or any income. i don't really have anywhere to go. i just don't feel my family is/would be the most supportive. i feel eventually it's all going to come to ahead when i can't hide anymore. at the moment i feel so ugh not being able to be myself. i just don't know what i'm supposed to do or what i'm going to do. my family doesn't speak or read english to get that out of the way. in the language they do speak they aren't very literate people so a book won't work. and my own skills would make writing a letter impossible. i'm just trapped and i hate it here.,0
14528,"okay so i just came here to rant/ get all excited because this girl i like said that we should go to barnes and noble together and i was like ??? yes â¤ï¸ðÿ˜«ðÿ˜ðÿ³ï¸ðÿœˆ im really excited shes really pretty and so cool ðÿ˜«ðÿ˜« sadly though it was supposed to be this weekend but she became busy so i guess next weekend ðÿ˜ž im kinda sad about it ive been moping around all day ðÿ˜žðÿ˜ž anyways wish me luck lets hope it happens and that she likes me ðÿ¤žðÿ½ðÿ³ï¸ðÿœˆâ¤ï¸ for context im 17, she/her pronouns, and im sapphic",0
23106," this is my first step in slowly coming out to people irl but for the sake of safety and the fact it's easier to come out to people of the internet instead of people you know, i am officially coming out. for much too long, i held myself down and lied to myself for much too long. i am 22 years old and while young, it feels like an eternity for how long it has been with living a lie. it's not a choice, i was born in the wrong body and i tried to living the lie but it did no good for me. today i acknowledge that i am a woman and am ready to transition when i can. if you're reading this post and still are questioning yourself. i wish you the best of luck, self-discovery is quite the journey. and lastly, feel free to dm me. especially everybody here. i'd love to hear your story no matter what stage! :)",0
23181,"i cant believe it!! after years of abuse and neglect from family, i managed to find a way to move out and get on my own. i managed to find a doctor that was trans-friendly and perscribed me hormones. i broke down crying during the video call i'm so fucking excited and happy right now. hopefully they'll be in contact with the pharmacy soon.  for those wondering, if you live in the united states, look into plume. i literally scheduled an appointment e just 5 days ago. they're so quick and also very nice. well....i guess no more [deadname]! hello world! hazel's ready for a new life!!",0
13126,"hi all, i am working on an original story after the ""moderate acknowledgement"" of my in a heartbeat fanfic. the new story focuses on brandon and edward, who slowly realise that they're in love with each other while their families have a lack of understanding on lgbt things.  i was hoping i'd be able to get some irl gay awakening stories to help ground the story in reality. if you feel comfortable sharing your story down below it'd be greatly appreciated. i'll mention your user name in the opening author's note. thanks i  advance ðÿ˜ƒ",0
12355,"i thought i was a top until almost a year ago, he was a good guy i met on grindr but after he had fucked me and after i had given him a bj he blocked me now i feel more of a bottom than ever without ever having the chance to try being top is this something normal that occurs for others as a problem or is this just me (id honestly prefer if we had conversations in dm's about this but comments works fine)",0
27519,"so, i am seriously confused about all of the new gender terms/definitions. is there a resource that anyone knows of that defines them all? 
i was taught there were only two genders and while i dont personally believe that gender changes based on feelings or preferences etc, i have children who are growing up in a world different than the one i was raised in, and i want to be able to have an informed discussion with them when and if the gender topic comes up in the future. 
im not trying to judge or belittle anyone reading this. your thoughts, feelings and beliefs are yours and mine are mine. im not here to change minds either way. im just looking to learn something. 
so, if you want to help a fellow human out please respond. but please be nice. thanks!!
",0
27789,"is there any consensus on a general term for all genders that are not cis male? i keep running into situations where i want a word for this, and end up saying ""all non\-cis\-male people"" which is obviously accurate but feels pretty awkward. i think i'm just looking for vocabulary to describe the kind of safety and allyship i feel around women and gender non\-conforming people as a whole.",0
14083,everything hurts so much. i wasnt expecting this at all. it came out of the blue and ive never hurt this bad before. i havent slept in 12 hours ive just been nonstop sobbing i cant handle this.  why cant i just be happy? i put my all into this relationship. i did so much for them. i drove down 2 hours to see them at 1 am the other week because they were having a mental crisis. i spent so much of my money on them because they didnt have a job. they actually made me feel wanted and loved and cared for and attractive and its all just gone. why do i always fuck everything up i dont understand why cant i just be a good person,0
10685,"just all of my life i thought i was straight, my entire fucking life. i know that's a bit of a lie, and that i was constantly questioning my sexuality. i know that deep down i always kind of knew i wasn't straight, but it was never an issue. i just never gave my sexuality any thought. i still can find girls pretty but i just can't for the life of me picture a loving relationship with one. it's so fucking confusing, why do i feel physically attracted to them but have no interest in them romantically or even sexually. why can't i feel happy with them. i dated a girl and felt nothing for her, the entire relationship was like one big game of pretend. there was no reason i should have felt that way, we were conventionally perfect for each other but i still felt nothing and had to break up with her. i couldn't stop thinking of other guys the entire time. when i woke up next to her i almost cried out of frustration, that night i had a dream that i was laying next to a cute blond haired guy instead and waking up to find out that wasn't true really upset me.  i know i can't be happy with a girl but what if i'm wrong? how do i reconcile with the fact that if i'm gay i can never have children like i wanted, i can never talk to my friends about him, and my family will see me differently and i'm not even 100% sure if my feelings are real? i mean i'm still into straight porn most of the time and i can still find girls attractive on an extremely superficial level so maybe i'm not gay. maybe i'm just being stupid. straight people don't have these feelings for as long as i have though, and i've had a girlfriend and i didn't like it at all. what if she was just not that attractive though and i need to find someone more attractive?  every time i think i'm straight again it only takes a day or even a few hours before i'm reminded that i'm not. i just don't know what to do anymore. i want a boyfriend so badly, i just want to know what it's like, but i don't want to tell my friends, i don't want my family to know, i don't want any record of it. i know that's impossible though, i know that people will have to find out eventually. i just feel so stuck, like i'm in some sort of purgatory.",0
